{
  "$schema": "http://json-schema.org/draft-07/schema#",
  "type": "array",
  "items": {
    "type": "object",
    "properties": {
      "code": { "type": "string" },
      "language_label": { "type": "string" },
      "overall_description": { "type": "string" },
      "components": {
        "type": "array",
        "items": {
          "type": "object",
          "properties": {
            "type": { "type": "string" },
            "name": { "type": "string" },
            "description": { "type": "string" }
          },
          "required": ["type", "name", "description"],
          "additionalProperties": false
        }
      }
    },
    "required": ["code", "language_label", "overall_description", "components"],
    "additionalProperties": false
  }
}
